{
  "schema_version": "2.0",
  "status": "complete",
  "collected_at": "2026-07-16T14:42:25Z",
  "workspace": {
    "creator_folder": "YouTube/MatskevichDima",
    "video_folder": "YouTube/MatskevichDima/Что сейчас происходит с AI 2026 - мацкевич с гостем"
  },
  "source": {
    "platform": "youtube",
    "video_id": "XScJOCjDx1M",
    "url": "https://www.youtube.com/watch?v=XScJOCjDx1M",
    "original_url": "https://www.youtube.com/watch?v=XScJOCjDx1M",
    "requested_start_seconds": null,
    "requested_start_context": null,
    "title": "AI, AGI, вайб-кодинг, светлое будущее и почему все вокруг работают больше? Егор Руди х Дима Мацкевич",
    "channel": "Dima Matskevich",
    "channel_id": "UCP1JXsJUF08ogMY5FF9b2Dg",
    "uploader": "Dima Matskevich",
    "uploader_id": "@MatskevichDima",
    "description": "▶︎ телеграм-канал Димы Мацкевича про ии → https://t.me/whyaimatskevich\n▶︎ ai-комьюнити brain love & robots →  https://t.me/brainloveandrobots\n▶︎ подать заявку в комьюнити → https://t.me/matskevichaibot?start=start\n▶︎ интенсивы по вайбкодингу каждые 63 дня → https://t.me/gptlovers\n\nв этом подкасте мы говорим про то, что обсуждают между собой предприниматели за кулисами: основатели на $500m+, фаундеры в долине, те кто впереди и которые сейчас тоже в растерянности\n  \nпочему даже у топовых предпринимателей сейчас полудепрессивные мысли?\npre-agi эра и что значит «жить когда ничего нельзя предсказать»?\nкакие профессии переживут ai?\nk-shape экономика: почему все начали работать больше?\nлетающие машины, поселения на луне и longevity — это уже не футуризм\nдефляция ai: что может случится с ценами через пару лет? \nharness больше чем модель — следующий 100x момент\nкаким должен быть наш персональный ai-ассистент? \n\nЕгор Руди\nсоциальный инженер, предприниматель\nсо-основатель сообщества Шмит16\n\nв прошлом со-основатель компании «Профи.ру», венчурного фонда s16vc и множества других компаний и проектов. со-основатель DOMA Portugal.\n\nодин из авторов каналов: \nШмит16 - t.me/Shmit16 - рассуждения про жизнь от предпринимателей\nШмит16 гид t.me/s16_guide - гид по отобранным тренерам и программам развития\n\nxprize $3.5m: позитивный фильм про будущее ai → https://youtu.be/b47oqZEeRGU?si=n12XQpOJ4KCVb7HZ\n\nтаймкоды: \n00:00 — интро\n01:49 — кто такой егор: профи.ру, s16, accumulator, high agency комьюнити\n04:55 — нерв №1: растерянность даже у топовых предпринимателей\n05:32 — pre-agi, sleep until singularity\n06:23 — что вообще такое agi  \n07:38 — куда инвестировать, когда мод исчезает за два месяца\n08:29 — peter diamandis, moonshot podcast, «мы уже в сингулярности»\n09:03 — обычные люди спрашивают «что делать», горизонт планирования сужается\n10:39 — opencloud-разочарование, волна разламывания\n12:14 — переобувание = главный скилл современности\n13:13 — нерв №2: кодекс vs claude code vs hermes\n14:30 — откуда брать апдейты: telegram-чаты founders of founders\n15:29 — почему классические курсы не работают, gconf как когорта\n16:34 — три метанавыка вместо университета\n18:38 — эмпатия к ai: theory of mind, а не сочувствие\n19:51 — вайб-кодеры массово поняли, что надо спать\n20:41 — нельзя навайб-кодить большую компанию, код — комодити\n21:47 — в топовых компаниях запретили программистам трогать код руками\n22:36 — «попробуй с ai, не получается — отложи на неделю»\n23:24 — давление документа, возврат к первым принципам\n24:53 — coding agents как обязательный интерфейс, ai native вакансии\n26:11 — мод исчезает за два месяца, ai-initiative компании\n28:44 — стадии освоения ai: от всемогущества к разочарованию\n30:24 — переход на hermes и почему не надо отключаться\n31:05 — sleep until singularity действительно makes sense\n32:27 — какие профессии вечные: art of holding space\n34:16 — у нас нет выбора: безумно интересно, не можем не работать\n35:36 — никто не может предсказать что будет\n36:27 — конкурс diamandis $3m: позитивный фильм про будущее ai\n37:04 — почему мозг overfit на негатив — эволюционно\n38:35 — позитивный outlook увеличивает вероятность успеха\n39:42 — bhag: нужен ли человечеству большой ai-визион\n40:30 — moonshot про миллионы безработных\n41:25 — k-shape theory: все начали работать больше, не меньше\n43:28 — позитивная картинка: летающие машины, ранчо, starlink\n45:06 — rv-комьюнити, self-drive, проснулся у красивого обрыва\n47:14 — человек должен работать максимум 4 часа в день\n49:30 — а у нас половина человечества за чертой бедности\n50:39 — поселения на луне, longevity, новые большие цели\n51:11 — дефляция: ai обвалит цены на всё\n52:30 — три периода: возможности → долина смерти → светлое будущее\n55:21 — мечта: ai приведёт к меньшему насилию в мире\n55:56 — оружие становится таргетированным, casualties падают\n56:56 — персональный дрон с молитвой вместо убийства\n57:25 — ai awakening, доступность психотерапии в 1000 раз\n01:00:30 — мечтаю о состояниях, а не финансовых целях\n01:01:46 — обращение к питеру, гермес как альтернатива\n01:02:48 — рекомендация: ставьте, но roi пока негативный\n01:05:37 — первый опыт opencloud: вот так должен работать софт\n01:07:22 — спасибо тем, кто рисково двигает человечество вперёд\n01:08:22 — чего не хватает opencloud, чтобы он реально работал\n01:09:32 — arc-agi тест и почему harness важнее модели\n01:12:08 — что такое harness и чем отличается от scaffolding\n01:13:25 — следующий фронтир: мультиагентная система, не модели\n01:14:14 — так устроено сознание — майкл левин\n01:16:15 — вдохновение для предпринимателей: ниши для harness\n01:18:31 — у каждого будет личный ai-ассистент как машина\n01:21:20 — как работает память в живых системах, гусеница и бабочка\n01:23:31 — каким должен быть персональный агент\n01:24:05 — парадокс мацкевича: максимальная польза = максимальный риск\n01:25:24 — почему это людям интересно: ai помнит твои долгосрочные цели\n01:29:42 — всё будет хорошо в конце",
    "duration_seconds": 5448,
    "duration_display": "1:30:48",
    "upload_date": "20260517",
    "published_timestamp_utc": 1779000005,
    "availability": "public",
    "live_status": "not_live",
    "license": null,
    "categories": [
      "People & Blogs"
    ],
    "tags": []
  },
  "statistics": {
    "view_count": 12003,
    "like_count": 247,
    "comment_count_reported": 51,
    "comments_extracted": 51,
    "root_comments": 43,
    "replies": 8,
    "comments_status": "complete",
    "channel_follower_count": 16800,
    "chapters_count": 62
  },
  "subtitles": {
    "manual_available": false,
    "manual_languages": [],
    "automatic_available": true,
    "automatic_language_count": 157,
    "source_language": "en",
    "primary_source": "automatic",
    "primary_transcript": "./XScJOCjDx1M.ru-orig.srt",
    "whisper_used": false
  },
  "files": {
    "raw_metadata": "./XScJOCjDx1M.info.json",
    "stats": "./XScJOCjDx1M.stats.json",
    "comments": "./XScJOCjDx1M.comments.json",
    "chapters": "./XScJOCjDx1M.chapters.json",
    "description": "./XScJOCjDx1M.description",
    "thumbnail": "./XScJOCjDx1M.jpg",
    "primary_transcript": "./XScJOCjDx1M.ru-orig.srt"
  },
  "limitations": [
    "Public statistics are a time-bound snapshot and may change.",
    "The primary transcript is automatically generated and may contain errors."
  ]
}
