{
  "schema_version": "2.0",
  "status": "complete",
  "collected_at": "2026-07-16T14:42:25Z",
  "workspace": {
    "creator_folder": "YouTube/Matt Wolfe",
    "video_folder": "YouTube/Matt Wolfe/Huge Ai news - внешний протоганист"
  },
  "source": {
    "platform": "youtube",
    "video_id": "NVP_paJarG4",
    "url": "https://www.youtube.com/watch?v=NVP_paJarG4",
    "original_url": "https://www.youtube.com/watch?v=NVP_paJarG4",
    "requested_start_seconds": null,
    "requested_start_context": null,
    "title": "AI News: Fable's Back But This New Model is Better?",
    "channel": "Matt Wolfe",
    "channel_id": "UChpleBmo18P08aKCIgti38g",
    "uploader": "Matt Wolfe",
    "uploader_id": "@mreflow",
    "description": "Here's the AI News you probably missed this week. Try @GensparkProduct with free credits by registering at this link: https://www.genspark.ai/?utm_source=yt&utm_campaign=mattwolfe02 \n\n#Genspark  #WorkWithGenspark\n\n\nDiscover More:\n🛠️ Explore AI Tools & News: https://futuretools.io/\n📰 Weekly Newsletter: https://futuretools.io/newsletter\n\nSocials:\n❌ Twiter/X: https://x.com/mreflow\n🖼️ Instagram: https://instagram.com/mr.eflow\n🧵 Threads: https://www.threads.net/@mr.eflow\n🟦 LinkedIn: https://www.linkedin.com/in/matt-wolfe-30841712/\n👍 Facebook: https://www.facebook.com/mattrwolfe\n\nResources From Today's Video:\nRedeploying Fable 5: https://www.anthropic.com/news/redeploying-fable-5\nFable 5 Nerfed: https://x.com/bridgemindai/status/2072662214704533888\nBuseyBench: https://buseybench.com/\nPreviewing GPT-5.6 Sol: https://openai.com/index/previewing-gpt-5-6-sol/\nOpenAI Government Stake: https://www.theverge.com/ai-artificial-intelligence/960588/openai-government-5-percent-stake-trump\nClaude Sonnet 5: https://www.anthropic.com/news/claude-sonnet-5\nGemini Omni Flash: https://blog.google/innovation-and-ai/models-and-research/gemini-models/gemini-omni-flash-nano-banana-2-lite/\nNotebookLM Video Overviews: https://x.com/NotebookLM/status/2071987494799716626\nClaude Science Workbench: https://www.anthropic.com/news/claude-science-ai-workbench\nCursor for iOS: https://cursor.com/blog/ios-mobile-app\nX MCP Server: https://techcrunch.com/2026/06/30/x-now-offers-an-mcp-server-to-make-its-platform-easier-for-ai-tools-to-use/\nGemini Meet Notes: https://blog.google/products-and-platforms/products/workspace/take-notes-for-me/\nGemini Spark Updates: https://blog.google/innovation-and-ai/products/gemini-app/gemini-spark-updates-june-2026/\nOpenAI Codex Hardware: https://www.theverge.com/ai-artificial-intelligence/959174/openai-codex-hardware-work-louder\n\nLet’s work together!\n- Brand, sponsorship & business inquiries: mattwolfe@smoothmedia.co\n\n#genspark #WorkWithGenspark #AINews #AITools #ArtificialIntelligence\n\nTime Stamps:\n0:00 Intro\n0:06 Fable 5 is Back\n2:26 Fable 5 Examples\n5:58 BuseyBench\n10:12 Fable 5 is Going Away\n11:05 Genspark Claw\n12:33 GPT-5.6\n15:25 Government AI Stake\n17:17 Claude Sonnet 5\n19:23 Nano Banana 2 Lite\n20:32 Gemini Omni Flash\n22:16 NotebookLM Shorts\n23:44 Claude Science\n24:20 Cursor on iOS\n24:44 X MCP\n25:04 AI in Google Meet\n25:29 Gemini Spark on macOS\n26:38 OpenAI New Hardware\n27:36 Final Thoughts\n28:54 Huh?",
    "duration_seconds": 1760,
    "duration_display": "29:20",
    "upload_date": "20260703",
    "published_timestamp_utc": 1783087206,
    "availability": "public",
    "live_status": "not_live",
    "license": null,
    "categories": [
      "Science & Technology"
    ],
    "tags": [
      "AI",
      "Artificial Intelligence",
      "FutureTools",
      "Futurism",
      "Machine Learning",
      "Deep Learning",
      "Future Tools",
      "Matt Wolfe",
      "AI News",
      "AI Tools",
      "openai",
      "anthropic",
      "claude",
      "fable",
      "mythos",
      "sol",
      "terra",
      "luna",
      "google",
      "gemini",
      "nano banana",
      "chatgpt",
      "gpt 5.6",
      "cursor",
      "benchmark",
      "xai",
      "grok",
      "claude code",
      "matt wolfe ai",
      "google ai",
      "image generator",
      "generative ai",
      "ai updates",
      "ai explained",
      "free ai tools",
      "gen ai",
      "new ai",
      "chagpt",
      "ai art",
      "ai agent",
      "gemini spark"
    ]
  },
  "statistics": {
    "view_count": 72149,
    "like_count": 2768,
    "comment_count_reported": 225,
    "comments_extracted": 225,
    "root_comments": 196,
    "replies": 29,
    "comments_status": "complete",
    "channel_follower_count": 979000,
    "chapters_count": 20
  },
  "subtitles": {
    "manual_available": false,
    "manual_languages": [],
    "automatic_available": true,
    "automatic_language_count": 157,
    "source_language": "en",
    "primary_source": "automatic",
    "primary_transcript": "./NVP_paJarG4.en-orig.srt",
    "whisper_used": false
  },
  "files": {
    "raw_metadata": "./NVP_paJarG4.info.json",
    "stats": "./NVP_paJarG4.stats.json",
    "comments": "./NVP_paJarG4.comments.json",
    "chapters": "./NVP_paJarG4.chapters.json",
    "description": "./NVP_paJarG4.description",
    "thumbnail": "./NVP_paJarG4.webp",
    "primary_transcript": "./NVP_paJarG4.en-orig.srt"
  },
  "limitations": [
    "Public statistics are a time-bound snapshot and may change.",
    "The primary transcript is automatically generated and may contain errors."
  ]
}
