{
  "schema_version": "2.0",
  "status": "complete",
  "collected_at": "2026-07-16T14:42:25Z",
  "workspace": {
    "creator_folder": "YouTube/MatskevichDima",
    "video_folder": "YouTube/MatskevichDima/ИИ твой друг, а не враг - Мацкевич у Ильи Рыбалко"
  },
  "source": {
    "platform": "youtube",
    "video_id": "TsBK35YnwBs",
    "url": "https://www.youtube.com/watch?v=TsBK35YnwBs",
    "original_url": "https://www.youtube.com/watch?v=TsBK35YnwBs",
    "requested_start_seconds": null,
    "requested_start_context": null,
    "title": "ИИ - ТВОЙ ДРУГ, а НЕ ВРАГ! И ВОТ ПОЧЕМУ 😳 Дима Мацкевич про эволюцию человека и ИИ",
    "channel": "Илья Рыбалко",
    "channel_id": "UCpHtMJ5hsOqJIW8_oaNIS0w",
    "uploader": "Илья Рыбалко",
    "uploader_id": "@Iliya_Rybalko",
    "description": "👉 Наш с Димой бесплатный бот, который проведёт вас «от нуля до единицы» в ИИ - https://t.me/aimetaskillsbot?start=youtube\n(я уже там)\n\nЗаменит ли искусственный интеллект вашу работу? В этом выпуске Илья Рыбалко и Дима Мацкевич честно разбирают будущее профессий: какие из них можно бросать уже сегодня, кто в зоне риска первым и почему страх перед ИИ - это не приговор, а сигнал начать действовать. Дима - эксперт в области ИИ, обладатель гранта Павла Дурова и выпускник Y Combinator.\n\nТакже Дима показывает как внедрил искусственный интеллект в свою жизнь, и рассказывает: Почему “учиться всю жизнь” больше не работает, Что такое «Теория К» - разлом между теми, кто пользуется ИИ, и остальными и Как устроены ИИ-агенты, Codex и Claude Code, и как собрать первых агентов с нуля, даже если вы пока умеете только писать в GPT-чат., а также  рассказывает как побороть страх\n\nСтавьте лайк, подписывайтесь и напишите в комментариях: боитесь ли вы, что ИИ заменит вашу работу? Среди комментаторов разыграем подарок от Димы. \n\n------------------------\n\nСОЦ СЕТИ ДИМЫ МАЦКЕВИЧ:\n\nНельзяgram -  / https://www.instagram.com/matskevich \nTelegram - Дима -  / https://t.me/Matskevich \nYoutube -   / https://www.youtube.com/@MatskevichDima/ \n\n------------------------\nИЛЬЯ:\n🤝 У ТЕБЯ БИЗНЕС ИЛИ ИНТЕРЕСНАЯ ЖИЗНЬ? ПИШИ СЮДА! ДАВАЙ СДЕЛАЕМ ВЫПУСК! Контакт в ТГ - https://t.me/eva1da\n\n📱 ЗАХОДИ СЮДА, ЧТОБЫ УЗНАТЬ ВЫИГРАЛ ЛИ ТЫ В КОНКУРСЕ? https://t.me/Iliya_rybalko  \n\n✅ Подписывайтесь на мой Нельзяграм: https://www.instagram.com/rybalko_iliya\n\nТаймкоды:\n00:00 Смотри в этом выпуске!\n01:30 Сразу же показываем роскошную виллу Димы!\n02:06 Какая профессия умр*т одной из первых? Ожидаемо\n03:46 Этот ИИ - матрас умеет такие вещи?! ЧТО?\n05:32 Партнерша Димы считает, что он - ФРИК?\n06:36 Все “удаленщики” пойдут работать на завод!\n10:00 Илья почему-то резко оказался в США…\n10:33 Дима - аутист?\n13:27 Дима получил ГРАНТ ОТ ДУРОВА! КАК?\n14:39 Факт про Дурова, который никто не знает?\n15:30 ИИ уже умеет делать ЭТО!\n17:21 Диме было всеравно, когда его друг у**р?\n18:51 Как вообще проходит день у такого человека?\n21:43 Дима ходит в зал с ноутбуком! ЗАЧЕМ?\n23:50 Как Дима получил визу талантов в США?\n27:18 Главный совет тем, кто НУБ в ИИ!\n29:36 Лайфхаки Как нельзя и можно обращаться с ИИ\n31:58 Лучший совет, чтобы начать легко пользоваться ИИ\n34:03 Очень необычное решение Димы и его друзей во время Ковида\n36:46 Почему видео Ильи стали выходить редко? Отвечаем!\n38:50 Дима УЖЕ строит проекты будущего!\n43:05 Почему Дима живет на Бали, хотя может жить в США?!\n46:04 Мы пришли в город будущего - Нуану\n47:41 Почему Бали - круто для детей?\n49:34 У тебя нет денег? Вот, что нужно делать!\n53:09 Что делать, если ты боишься ИИ?! Ответ есть\n54:48 Просто посмотрите на этот закат!\n56:36 ПРОСТО НЕРЕАЛЬНЫЙ РОЗЫГРЫШ ПРИЗОВ ДЛЯ ВАС!\n\n#димамацкевич #интервью #ии",
    "duration_seconds": 3527,
    "duration_display": "58:47",
    "upload_date": "20260620",
    "published_timestamp_utc": 1781971167,
    "availability": "public",
    "live_status": "not_live",
    "license": null,
    "categories": [
      "People & Blogs"
    ],
    "tags": [
      "будущее профессий",
      "искусственный интеллект",
      "заменит ли ИИ",
      "работа и ИИ",
      "развитие технологий",
      "нейросеть",
      "нейросети",
      "профессии будущего",
      "ИИ",
      "АИ",
      "искусственный интеллект видео",
      "кодекс ии",
      "codex агент",
      "codex обзор",
      "claude code",
      "клауд код",
      "ии агенты",
      "ии агенты для бизнеса",
      "ии агенты с нуля",
      "ии агенты создание",
      "ии уничтожит человечество",
      "дима мацкевич",
      "дима мацкевич оля маркес",
      "мацкевич",
      "подкаст",
      "интервью",
      "илья рыбалко",
      "илья рыбалко интервью",
      "ai"
    ]
  },
  "statistics": {
    "view_count": 13255,
    "like_count": 390,
    "comment_count_reported": 193,
    "comments_extracted": 193,
    "root_comments": 141,
    "replies": 52,
    "comments_status": "complete",
    "channel_follower_count": null,
    "chapters_count": 28
  },
  "subtitles": {
    "manual_available": false,
    "manual_languages": [],
    "automatic_available": true,
    "automatic_language_count": 157,
    "source_language": "ru",
    "primary_source": "automatic",
    "primary_transcript": "./TsBK35YnwBs.ru-orig.srt",
    "whisper_used": false
  },
  "files": {
    "raw_metadata": "./TsBK35YnwBs.info.json",
    "stats": "./TsBK35YnwBs.stats.json",
    "comments": "./TsBK35YnwBs.comments.json",
    "chapters": "./TsBK35YnwBs.chapters.json",
    "description": "./TsBK35YnwBs.description",
    "thumbnail": "./TsBK35YnwBs.webp",
    "primary_transcript": "./TsBK35YnwBs.ru-orig.srt"
  },
  "limitations": [
    "Public statistics are a time-bound snapshot and may change.",
    "The primary transcript is automatically generated and may contain errors."
  ]
}
