{
  "schema_version": "2.0",
  "status": "complete",
  "collected_at": "2026-07-16T14:42:25Z",
  "workspace": {
    "creator_folder": "YouTube/Matt Wolfe",
    "video_folder": "YouTube/Matt Wolfe/yke4fLQUsh4"
  },
  "source": {
    "platform": "youtube",
    "video_id": "yke4fLQUsh4",
    "url": "https://www.youtube.com/watch?v=yke4fLQUsh4",
    "original_url": "https://www.youtube.com/watch?v=yke4fLQUsh4",
    "requested_start_seconds": null,
    "requested_start_context": null,
    "title": "Build An AI Second Brain Knowledge Base (Step-By-Step)",
    "channel": "Matt Wolfe",
    "channel_id": "UChpleBmo18P08aKCIgti38g",
    "uploader": "Matt Wolfe",
    "uploader_id": "@mreflow",
    "description": "Here's how to build an AI second brain. Launch your own AI agents with OpenClaw at http://hostinger.com/mattopenclaw and get 10% off with code MATTWOLFE\n\nDiscover More:\n🛠️ Explore AI Tools & News: https://futuretools.io/\n📰 Weekly Newsletter: https://futuretools.io/newsletter\n\nSocials:\n❌ Twiter/X: https://x.com/mreflow\n🖼️ Instagram: https://instagram.com/mr.eflow\n🧵 Threads: https://www.threads.net/@mr.eflow\n🟦 LinkedIn: https://www.linkedin.com/in/matt-wolfe-30841712/\n👍 Facebook: https://www.facebook.com/mattrwolfe\n\nResources From Today's Video:\nKarpathy Tweet: https://x.com/karpathy/status/2039805659525644595\nKarpathy GitHub Page: https://gist.github.com/karpathy/442a6bf555914893e9891c11519de94f\nObsidian: https://obsidian.md/\nObsidian Web Clipper: https://obsidian.md/clipper\nCodex App: https://chatgpt.com/codex/\n\nLet’s work together!\n- Brand, sponsorship & business inquiries: mattwolfe@smoothmedia.co\n\n#AINews #AITools #ArtificialIntelligence\n\nTime Stamps:\n0:00 Intro\n1:07 The System Overview\n6:14 OpenClaw on Hostinger\n8:03 Karpathy LLM Wiki Concept\n8:27 Tools Needed\n9:41 The Buildout\n18:19 Querying the Wiki\n19:28 Manually Updating the Agent\n21:25 Letting AI Update the Agent & Building Journal / CRM\n24:46 Testing the CRM\n26:01 Testing the Journal\n29:11 Automating The Wiki Linking\n30:30 Backing it all up to GitHub\n31:41 Recap and Final Thoughts",
    "duration_seconds": 2036,
    "duration_display": "33:56",
    "upload_date": "20260506",
    "published_timestamp_utc": 1778091581,
    "availability": "public",
    "live_status": "not_live",
    "license": null,
    "categories": [
      "Science & Technology"
    ],
    "tags": [
      "AI",
      "Artificial Intelligence",
      "FutureTools",
      "Deep Learning",
      "Future Tools",
      "Matt Wolfe",
      "AI Tools",
      "Codex",
      "OpenAI",
      "ChatGPT",
      "Obsidian",
      "llm",
      "wiki",
      "karpathy",
      "andrej karpathy",
      "second brain",
      "ai apps",
      "how to use ai",
      "2nd brain",
      "knowledge",
      "knowledge management",
      "zettelkasten",
      "ai wiki",
      "llm wiki",
      "kms",
      "knowledge management system",
      "obsidian tutorial",
      "self improvement",
      "ai automation",
      "ai productivity tools",
      "second brain ai",
      "build a second brain",
      "ai architecture",
      "obsidian",
      "ai knowledge systems"
    ]
  },
  "statistics": {
    "view_count": 140533,
    "like_count": 3988,
    "comment_count_reported": 209,
    "comments_extracted": 209,
    "root_comments": 177,
    "replies": 32,
    "comments_status": "complete",
    "channel_follower_count": 979000,
    "chapters_count": 14
  },
  "subtitles": {
    "manual_available": false,
    "manual_languages": [],
    "automatic_available": true,
    "automatic_language_count": 157,
    "source_language": "en",
    "primary_source": "automatic",
    "primary_transcript": "./yke4fLQUsh4.en-orig.srt",
    "whisper_used": false
  },
  "files": {
    "raw_metadata": "./yke4fLQUsh4.info.json",
    "stats": "./yke4fLQUsh4.stats.json",
    "comments": "./yke4fLQUsh4.comments.json",
    "chapters": "./yke4fLQUsh4.chapters.json",
    "description": "./yke4fLQUsh4.description",
    "thumbnail": "./yke4fLQUsh4.webp",
    "primary_transcript": "./yke4fLQUsh4.en-orig.srt"
  },
  "limitations": [
    "Public statistics are a time-bound snapshot and may change.",
    "The primary transcript is automatically generated and may contain errors."
  ]
}
