{
  "schema_version": "2.0",
  "status": "complete",
  "collected_at": "2026-07-16T14:42:25Z",
  "workspace": {
    "creator_folder": "YouTube/Matt Wolfe",
    "video_folder": "YouTube/Matt Wolfe/AI news - внешний протогонист"
  },
  "source": {
    "platform": "youtube",
    "video_id": "EOCRtSnvNNE",
    "url": "https://www.youtube.com/watch?v=EOCRtSnvNNE",
    "original_url": "https://www.youtube.com/watch?v=EOCRtSnvNNE",
    "requested_start_seconds": null,
    "requested_start_context": null,
    "title": "AI News: GPT-5.6 and the new Super App are a Massive Leap!",
    "channel": "Matt Wolfe",
    "channel_id": "UChpleBmo18P08aKCIgti38g",
    "uploader": "Matt Wolfe",
    "uploader_id": "@mreflow",
    "description": "Here's the AI News You Might Have Missed This Week. Try my Shorts Broll Generator and get $1,000 in free credits for Hyperagent here: https://hyperagent.com/marketplace/s/ccs01KWW9863B_K2WF34HK4MHCBT5N?utm_source=youtube&utm_medium=influencer&utm_campaign=MATT&promo=MATT\n\nDiscover More:\n🛠️ Explore AI Tools & News: https://futuretools.io/\n📰 Weekly Newsletter: https://futuretools.io/newsletter\n\nSocials:\n❌ Twiter/X: https://x.com/mreflow\n🖼️ Instagram: https://instagram.com/mr.eflow\n🧵 Threads: https://www.threads.net/@mr.eflow\n🟦 LinkedIn: https://www.linkedin.com/in/matt-wolfe-30841712/\n👍 Facebook: https://www.facebook.com/mattrwolfe\n\nResources From Today's Video:\nGPT-5.6: https://openai.com/index/gpt-5-6/\nChatGPT Ambitious Work: https://openai.com/index/chatgpt-for-your-most-ambitious-work/\nGPT-Live: https://openai.com/index/introducing-gpt-live/\nSolBonk Game: https://solbonk-sunpit.mreflow.chatgpt.site/\nGrok 4.5: https://x.ai/news/grok-4-5\nMuse Spark 1.1: https://ai.meta.com/blog/introducing-muse-spark-meta-model-api/\nMuse Image: https://about.fb.com/news/2026/07/introducing-muse-image-meta-ai/\nClaude Fable 5 Access: https://x.com/claudeai/status/2074548242386178258\nClaude Rate Limits Reset: https://x.com/ClaudeDevs/status/2075279141352706215\nCowork Web & Mobile: https://claude.com/blog/cowork-web-mobile\nReflect With Claude: https://www.anthropic.com/news/reflect-with-claude\nGlobal Workspace Research: https://www.anthropic.com/research/global-workspace\nGoogle Photos Video Remix: https://blog.google/products-and-platforms/products/photos/video-remix/\nSeedream 5.0 Pro: https://seed.bytedance.com/en/seedream5_0_pro\n\nLet’s work together!\n- Brand, sponsorship & business inquiries: mattwolfe@smoothmedia.co\n\n#AINews #AITools #ArtificialIntelligence\n\nTime Stamps:\n0:00 Intro\n0:12 GPT-5.6\n3:36 OpenAI SuperApp\n12:54 Hyperagent\n16:12 GPT-Live\n18:44 Grok 4.5\n23:27 Muse Spark 1.1\n26:15 Fable Comparison\n27:39 Muse Image\n29:04 New Future Tools\n29:27 More Fable Access\n30:24 Claude Cowork Mobile\n31:12 Claude Reflect\n31:37 J-Space\n32:44 Google Photos Video Update\n33:03 Seedream 5.0 Pro\n34:02 GPT-5.6 vs. Fable\n38:16 WTF?",
    "duration_seconds": 2320,
    "duration_display": "38:40",
    "upload_date": "20260710",
    "published_timestamp_utc": 1783694513,
    "availability": "public",
    "live_status": "not_live",
    "license": null,
    "categories": [
      "Science & Technology"
    ],
    "tags": [
      "AI",
      "Artificial Intelligence",
      "FutureTools",
      "Futurism",
      "Machine Learning",
      "Deep Learning",
      "Future Tools",
      "Matt Wolfe",
      "AI News",
      "AI Tools",
      "claude fable 5",
      "gpt-5.6",
      "gpt 5.6 sol",
      "gpt 5.6 vs fable 5",
      "openai",
      "chatgpt",
      "chatgpt work",
      "codex",
      "open ai",
      "anthropic",
      "claude",
      "xai",
      "grok",
      "meta",
      "meta spark",
      "ai launch",
      "grok 4.5",
      "ai agents",
      "agi",
      "gpt-5.6 terra",
      "ai videos",
      "gen ai",
      "chagpt",
      "agentic ai",
      "ai voice",
      "Seedream",
      "Muse",
      "Meta"
    ]
  },
  "statistics": {
    "view_count": 113150,
    "like_count": 3723,
    "comment_count_reported": 284,
    "comments_extracted": 284,
    "root_comments": 222,
    "replies": 62,
    "comments_status": "complete",
    "channel_follower_count": 979000,
    "chapters_count": 18
  },
  "subtitles": {
    "manual_available": false,
    "manual_languages": [],
    "automatic_available": true,
    "automatic_language_count": 157,
    "source_language": "en",
    "primary_source": "automatic",
    "primary_transcript": "./EOCRtSnvNNE.en-orig.srt",
    "whisper_used": false
  },
  "files": {
    "raw_metadata": "./EOCRtSnvNNE.info.json",
    "stats": "./EOCRtSnvNNE.stats.json",
    "comments": "./EOCRtSnvNNE.comments.json",
    "chapters": "./EOCRtSnvNNE.chapters.json",
    "description": "./EOCRtSnvNNE.description",
    "thumbnail": "./EOCRtSnvNNE.webp",
    "primary_transcript": "./EOCRtSnvNNE.en-orig.srt"
  },
  "limitations": [
    "Public statistics are a time-bound snapshot and may change.",
    "The primary transcript is automatically generated and may contain errors."
  ]
}
